{
  "access_surface_ref": "source-surface.postgresql18.github_actions.sql_logical.v1",
  "budgets": {
    "concurrency": "small synthetic workload",
    "cost": "provider metering excluded",
    "memory": "not benchmarked",
    "rate": "not benchmarked",
    "time": "GitHub Actions job bound"
  },
  "change_capture": {
    "cursor_or_position": "0/179A570",
    "duplicate_policy": "consumer-level dedup not qualified",
    "gap_policy": "refuse if slot missing/invalid or WAL unavailable",
    "mode": "logical_slot_pgoutput_native_probe",
    "ordering_scope": "PostgreSQL transaction/WAL order",
    "retention_expiry_policy": "re-snapshot/recreate plan after explicit loss assessment"
  },
  "completion_claim": false,
  "connector_ref": "connector.psycopg3.postgresql18.native_probe.v1",
  "deletion_and_correction": {
    "delete": "hard delete tested",
    "replica_identity": "default primary-key identity; old-row detail not generalized",
    "update": "update tested"
  },
  "handoff": {
    "gap_detection": "WAL LSN and reconciliation required",
    "overlap_policy": "explicitly unresolved for external connector",
    "snapshot_to_change_law": "research slice binds snapshot and logical slot identities but does not yet prove zero-gap external connector handoff",
    "unknown_outcome_policy": "do not seal as CDC-complete"
  },
  "initial_cut": {
    "boundary_identity": "logical slot LSN + reconciled logical rowset",
    "consistency_requirement": "repeatable-read exact transaction snapshot",
    "mode": "snapshot"
  },
  "non_collapse": [
    "plan != PostgreSQL occurrence",
    "plan != logical slot",
    "plan != psycopg connector",
    "snapshot + WAL visibility != zero-gap external CDC handoff",
    "plan != governed data cut"
  ],
  "object_selection": {
    "columns": [
      "id",
      "value",
      "amount",
      "updated_at",
      "note"
    ],
    "include": [
      "public.b08_items"
    ]
  },
  "occurrence_ref": "source-occurrence.postgresql18.github_actions.synthetic.v1",
  "output_cut_contract": {
    "completeness_state_required": true,
    "governed_cut_required": true,
    "lineage_required": true
  },
  "plan_id": "acquisition-plan.postgresql18.github_actions.snapshot_plus_native_logical.v1",
  "reconciliation": {
    "count_or_hash": "canonical logical rowset SHA-256 and count",
    "delete_coverage": "DELETE id=2 visible in final snapshot and WAL advancement",
    "failure_posture": "REFUSE_CUT",
    "frequency": "end of synthetic run",
    "key_coverage": "primary key id"
  },
  "refusal_rules": [
    "wal_level not logical",
    "logical slot unavailable",
    "schema/key discovery mismatch",
    "reconciliation mismatch",
    "credential/authorization insufficient",
    "slot/WAL retention loss",
    "connector version changes without re-execution"
  ],
  "requested_source_class_refs": [
    "source.operational_database.relational_transactional",
    "source.event_messaging_cdc.transaction_log_cdc"
  ],
  "retry_and_idempotency": {
    "logical": "slot-aware resume required; not fully qualified",
    "snapshot": "restart transaction and reconcile"
  },
  "schema_change": {
    "breaking_change_policy": "new plan/cut edition",
    "compatibility": "exact final schema for this cut",
    "discovery": "information_schema",
    "unknown_field_policy": "fail closed"
  },
  "security": {
    "audit": "GitHub Actions receipt",
    "credential_ref_only": true,
    "least_privilege": "NOT SATISFIED: harness uses postgres superuser for logical slot setup",
    "network_boundary": "runner-local container"
  },
  "status": "EXECUTABLE"
}
